{"source_url": "https://web.archive.org", "url": "https://web.archive.org/web/20201212085956id_/https://www.telemundonuevainglaterra.com/noticias/eeuu/chipotle-acuerda-pagar-multa-record-de-25-millones-por-comida-contaminada/2038561/", "title": "Chipotle pagar\u00e1 multa r\u00e9cord de $25 millones por brotes de norovirus", "top_image": "https://media.telemundoboston.com/2019/09/Chipotle-abrira-restaurante-de-hamburguesas.jpg?fit=1200%2C675", "meta_img": "https://media.telemundoboston.com/2019/09/Chipotle-abrira-restaurante-de-hamburguesas.jpg?fit=1200%2C675", "images": ["https://media.telemundoboston.com/2019/09/tlmd-getty-mercados-china-12343.jpg?resize=850%2C478", "https://media.telemundoboston.com/2019/09/huerto-casero-EFE.jpg?resize=850%2C478", "https://sb.scorecardresearch.com/p?c1=2&c2=6035083&cv=2.0&cj=1", "https://media.telemundoboston.com/2019/09/TLMD_NI_On_Light@3x.png?fit=435%2C120", "https://media.telemundoboston.com/2019/09/Chipotle-abrira-restaurante-de-hamburguesas.jpg?fit=1200%2C675", "https://media.telemundoboston.com/2019/09/TLMD_NI_On_Dark-@3x-3.png?fit=435%2C120", "https://media.telemundoboston.com/2019/09/Chipotle-abrira-restaurante-de-hamburguesas.jpg?resize=850%2C478"], "movies": [], "text": "Chipotle Mexican Grill Inc., acord\u00f3 este martes pagar una multa r\u00e9cord de $25 millones para resolver cargos criminales que incluyen haber servido comida contaminada que enferm\u00f3 a m\u00e1s de 1,100 personas en Estados Unidos entre 2015 y 2018, dijeron fiscales federales.\n\nLa compa\u00f1\u00eda de comida r\u00e1pida fue acusada en la corte federal de Los \u00c1ngeles de dos cargos de violaci\u00f3n de la Ley de Alimentos, Drogas y Cosm\u00e9ticos al servir alimentos adulterados que en algunos casos causaron brotes de norovirus, que causa diarrea, v\u00f3mitos y calambres abdominales en restaurantes. El virus se transmite f\u00e1cilmente por personas que manejan mal los alimentos.\n\nLa compa\u00f1\u00eda admiti\u00f3 que las malas pr\u00e1cticas de seguridad, como no mantener los alimentos a temperaturas adecuadas para evitar el crecimiento de pat\u00f3genos, enfermaron a los clientes en Los \u00c1ngeles y el cercano Simi Valley, as\u00ed como en Boston, Sterling, Virginia y Powell, Ohio.\n\nLa compa\u00f1\u00eda con sede en Newport Beach, California, evitar\u00e1 la condena al instituir un mejor programa de seguridad alimentaria.\n\nLos fiscales federales dijeron que la multa era la m\u00e1s grande en un caso de seguridad alimentaria.\n\n\"Chipotle no se asegur\u00f3 de que sus empleados entendieran y cumplieran con sus protocolos de seguridad alimentaria, lo que provoc\u00f3 que cientos de clientes en todo el pa\u00eds se enfermaran\", dijo el fiscal federal Nick Hanna en un comunicado.\n\n\"La fuerte penalizaci\u00f3n de hoy, junto con las decenas de millones de d\u00f3lares que Chipotle ya ha gastado para actualizar su programa de seguridad alimentaria desde 2015, deber\u00eda dar lugar a mayores protecciones para los clientes de Chipotle y recordar a otros en la industria que revisen y mejoren sus propias pr\u00e1cticas de salud y seguridad\u201d.\n\nLos brotes de norovirus comenzaron en agosto de 2015 cuando 234 consumidores y empleados de un Chipotle en Simi Valley se enfermaron. Un empleado que vomit\u00f3 fue enviado a su casa, pero la enfermedad no se inform\u00f3 internamente, como lo exig\u00edan las normas, y los procedimientos de seguridad alimentaria no se implementaron hasta dos d\u00edas despu\u00e9s de que varios clientes informaron que se enfermaron.\n\nEn el transcurso de nueve d\u00edas en diciembre de 2015, 141 personas informaron enfermedades de tipo norovirus despu\u00e9s de visitar un restaurante Chipotle en Boston.\n\nLos fiscales dijeron que el brote probablemente fue causado despu\u00e9s de que se orden\u00f3 a un empleado que continuara trabajando tras vomitar en el restaurante.\n\nUna orden de servicio de comida al establecimiento, dos d\u00edas despu\u00e9s, enferm\u00f3 a los miembros del equipo de baloncesto del Boston College.\n\nEn julio de 2018, casi 650 personas se enfermaron despu\u00e9s de cenar en un restaurante Chipotle en Powell, Ohio. Ese brote se relacion\u00f3 con bacterias que proliferan cuando los alimentos no se mantienen a las temperaturas adecuadas.", "keywords": [], "meta_keywords": ["Boston", "Los \u00c1ngeles", "establecimiento", "Estados Unidos", "restaurantes", "Powell", "Simi Valley", "pa\u00eds", "sede", "casa", "Newport Beach", "California", "compa\u00f1\u00eda", "equipo", "Boston College", "brotes", "violaci\u00f3n", "v\u00f3mitos", "penalizaci\u00f3n", "cargos", "Chipotle Mexican Grill Inc.", "multa", "comida", "norovirus", "virus", "programa", "comida", "diarrea", "corte", "seguridad", "casos", "seguridad", "Cosm\u00e9ticos", "Ley", "calambres", "seguridad", "temperaturas", "pr\u00e1cticas", "caso", "protocolos", "crecimiento", "seguridad", "condena", "seguridad", "seguridad", "seguridad", "pat\u00f3genos", "pr\u00e1cticas", "lugar", "protecciones", "enfermedad", "salud", "industria", "decenas", "normas", "procedimientos", "temperaturas", "enfermedades", "baloncesto", "bacterias", "transcurso", "tipo", "servicio", "orden", "Chipotle", "Multas"], "tags": ["MEXICO", "Coronavirus", "Multas", "Chipotle"], "authors": [], "publish_date": "Tue Apr 21 16:24:48 2020", "summary": "", "article_html": "", "meta_description": "La compa\u00f1\u00eda con sede en Newport Beach, California, evitar\u00e1 la condena al instituir un mejor programa de seguridad alimentaria.", "meta_lang": "es", "meta_favicon": "https://media.telemundoboston.com/2019/09/cropped-TLMD_Nueva-Inglaterra.png?fit=32%2C32", "meta_data": {"viewport": "width=device-width, initial-scale=1", "generator": "WordPress 5.5.2", "og": {"site_name": "Telemundo Nueva Inglaterra", "type": "article", "description": "La compa\u00f1\u00eda con sede en Newport Beach, California, evitar\u00e1 la condena al instituir un mejor programa de seguridad alimentaria.", "title": "Chipotle pagar\u00e1 multa r\u00e9cord de $25 millones por brotes de norovirus", "url": "https://www.telemundonuevainglaterra.com/noticias/eeuu/chipotle-acuerda-pagar-multa-record-de-25-millones-por-comida-contaminada/2038561/", "image": "https://media.telemundoboston.com/2019/09/Chipotle-abrira-restaurante-de-hamburguesas.jpg?fit=1200%2C675"}, "google-site-verification": "8pTRmr8JheK3WnXo8L7mWrcH4vCnrWf6AHIkAgw_KEU", "fb": {"app_id": 342515639259748}, "twitter": {"card": "summary_large_image", "site": "@@TelemundoNI", "creator": "@@TelemundoNI", "description": "La compa\u00f1\u00eda con sede en Newport Beach, California, evitar\u00e1 la condena al instituir un mejor programa de seguridad alimentaria.", "title": "Chipotle pagar\u00e1 multa r\u00e9cord de $25 millones por brotes de norovirus", "url": "https://www.telemundonuevainglaterra.com/noticias/eeuu/chipotle-acuerda-pagar-multa-record-de-25-millones-por-comida-contaminada/2038561/", "image": "https://media.telemundoboston.com/2019/09/Chipotle-abrira-restaurante-de-hamburguesas.jpg?fit=1200%2C675"}, "article": {"opinion": "false", "content_tier": "free", "publisher": "https://www.facebook.com/TelemundoNI/"}, "description": "La compa\u00f1\u00eda con sede en Newport Beach, California, evitar\u00e1 la condena al instituir un mejor programa de seguridad alimentaria.", "keywords": "Boston, Los \u00c1ngeles, establecimiento, Estados Unidos, restaurantes, Powell, Simi Valley, pa\u00eds, sede, casa, Newport Beach, California, compa\u00f1\u00eda, equipo, Boston College, brotes, violaci\u00f3n, v\u00f3mitos, penalizaci\u00f3n, cargos, Chipotle Mexican Grill Inc., multa, comida, norovirus, virus, programa, comida, diarrea, corte, seguridad, casos, seguridad, Cosm\u00e9ticos, Ley, calambres, seguridad, temperaturas, pr\u00e1cticas, caso, protocolos, crecimiento, seguridad, condena, seguridad, seguridad, seguridad, pat\u00f3genos, pr\u00e1cticas, lugar, protecciones, enfermedad, salud, industria, decenas, normas, procedimientos, temperaturas, enfermedades, baloncesto, bacterias, transcurso, tipo, servicio, orden, Chipotle, Multas", "sailthru.title": "Chipotle pagar\u00e1 multa r\u00e9cord de $25 millones por brotes de norovirus", "sailthru.description": "La compa\u00f1\u00eda con sede en Newport Beach, California, evitar\u00e1 la condena al instituir un mejor programa de seguridad alimentaria.", "sailthru.tags": "Boston, Los \u00c1ngeles, establecimiento, Estados Unidos, restaurantes, Powell, Simi Valley, pa\u00eds, sede, casa, Newport Beach, California, compa\u00f1\u00eda, equipo, Boston College, brotes, violaci\u00f3n, v\u00f3mitos, penalizaci\u00f3n, cargos, Chipotle Mexican Grill Inc., multa, comida, norovirus, virus, programa, comida, diarrea, corte, seguridad, casos, seguridad, Cosm\u00e9ticos, Ley, calambres, seguridad, temperaturas, pr\u00e1cticas, caso, protocolos, crecimiento, seguridad, condena, seguridad, seguridad, seguridad, pat\u00f3genos, pr\u00e1cticas, lugar, protecciones, enfermedad, salud, industria, decenas, normas, procedimientos, temperaturas, enfermedades, baloncesto, bacterias, transcurso, tipo, servicio, orden, Chipotle, Multas", "sailthru.type": "article", "sailthru.date": "2020-04-21T16:24:48+00:00", "msapplication-TileImage": "https://media.telemundoboston.com/2019/09/cropped-TLMD_Nueva-Inglaterra.png?fit=270%2C270"}, "canonical_link": "https://www.telemundo52.com/noticias/local/chipotle-acuerda-pagar-multa-record-de-25-millones-por-comida-contaminada/2073653/"}