{"source_url": "https://web.archive.org", "url": "https://web.archive.org/web/20201216022653id_/https://www.telemundo31.com/noticias/eeuu/guardia-costera-cruceros-con-enfermos-deben-permanecer-en-el-mar/1982428/", "title": "Guardia Costera: cruceros con enfermos deben permanecer en el mar", "top_image": "https://media.telemundo31.com/2019/09/GettyImages-1208425344.jpg?fit=1200%2C675", "meta_img": "https://media.telemundo31.com/2019/09/GettyImages-1208425344.jpg?fit=1200%2C675", "images": ["https://media.telemundo31.com/2019/09/TMD_31_On_Light-@3x.png?fit=183%2C120", "https://sb.scorecardresearch.com/p?c1=2&c2=6035083&cv=2.0&cj=1", "https://media.telemundo31.com/2019/09/TLMD_31_On_Dark-@3x-3.png?fit=183%2C120", "https://media.telemundo31.com/2019/09/GettyImages-1208425344.jpg?fit=1200%2C675"], "movies": [], "text": "La Guardia Costera de los Estados Unidos emiti\u00f3 una orden a todos los cruceros en la que piden que permanezcan en el mar donde puedan ser retenidos \"indefinidamente\" durante la pandemia de coronavirus y que est\u00e9n preparados para enviar a los pasajeros gravemente enfermos a los pa\u00edses donde est\u00e1n registrados los buques.\n\nPara la mayor\u00eda de los cruceros del sur de la Florida, eso significa las Bahamas, donde la gente todav\u00eda se est\u00e1 recuperando de los huracanes del a\u00f1o pasado.\n\nLas reglas, que se aplican a cualquier embarcaci\u00f3n que lleve m\u00e1s de 50 personas, se emitieron en un bolet\u00edn de seguridad del 29 de marzo firmado por el Contralmirante de la Guardia Costera E.C. Jones, cuyo distrito incluye Florida, Georgia, Carolina del Sur y Puerto Rico, destac\u00f3 AP.\n\nLa medida adoptada por la guardia costera le ordena a todos los barcos de bandera extranjera que naveguen dentro del s\u00e9ptimo distrito, que incluye puertos de la Florida, que incrementen sus capacidades m\u00e9dicas abordo y eviten trasladar personas enfermas a hospitales en tierra.\n\nUn anuncio que agudiza el drama de cientos de pasajeros y tripulantes del crucero Zaandam y su barco gemelo, el Rotterdam, de la compa\u00f1\u00eda Holand America, que navegan en aguas del Caribe con destino a Port Everglades.\n\n\"Nosotros somos una poblaci\u00f3n de 800 pasajeros asintom\u00e1ticos, o sea nosotros no hemos registrado ning\u00fan tipo de enfermedad por ahora, eso no quiere decir que en alg\u00fan camarote haya alguien que tenga fiebre que no lo sabemos. Pero la poblaci\u00f3n enferma est\u00e1 en el buque Zaandam que es el que necesita urgentemente poder ir a un puerto para proveerle suministros y atender a la gente que est\u00e1 enferma\", asegura Juan Federico Henning, pasajero del Rotterdam.\n\nFuncionarios federales, estatales y locales han estado negociando si dos cruceros de Holland America que hab\u00edan quedado varados en la costa de Panam\u00e1 con pasajeros enfermos y muertos podr\u00edan atracar en Port Everglades esta semana. M\u00e1s de 300 ciudadanos estadounidenses est\u00e1n en los dos barcos.\n\nEl Zaandam, que zarp\u00f3 a principios de marzo en un viaje sudamericano, transporta pasajeros y tripulaci\u00f3n enfermos, mientras que los pasajeros que no muestran s\u00edntomas fueron transferidos a un barco gemelo, el Rotterdam, enviado a la regi\u00f3n para ayudar.\n\nAmbos barcos despejaron el Canal de Panam\u00e1 y navegan hacia Florida. Dos de cuatro muertes en el Zaandam han sido atribuidas a COVID-19 y nueve personas han dado positivo por el nuevo coronavirus, dijo la compa\u00f1\u00eda.\n\nM\u00e1s de dos docenas de cruceros est\u00e1n alineados en Port Miami y Port Everglades o esperan en alta mar, inform\u00f3 el Miami Herald. La mayor\u00eda solo tiene tripulaci\u00f3n a bordo, pero varios a\u00fan transportan pasajeros y se dirigen hacia los puertos del sur de Florida. Carnival notific\u00f3 a la SEC el martes que a\u00fan tiene m\u00e1s de 6,000 pasajeros en el mar.", "keywords": [], "meta_keywords": ["Florida", "mar", "pa\u00edses", "sur", "Bahamas", "Zaandam", "Puerto Rico", "Carolina del Sur", "Georgia", "distrito", "sur", "puertos", "costa", "Canal de Panam\u00e1", "Panam\u00e1", "estadounidenses", "regi\u00f3n", "sudamericano", "Rotterdam", "Guardia Costera de los Estados Unidos", "Miami Herald", "AP", "SEC", "compa\u00f1\u00eda", "huracanes", "muertes", "viaje", "cruceros", "buques", "coronavirus", "embarcaci\u00f3n", "orden", "tripulaci\u00f3n", "cruceros", "Port Everglades", "cruceros", "alta mar", "docenas", "seguridad", "bolet\u00edn", "Contralmirante", "reglas", "bordo", "s\u00edntomas", "Dos", "COVID-19", "Coronavirus", "Florida"], "tags": ["Condado Osceola", "Coronavirus", "Florida", "Condado Orange", "Festividades"], "authors": [], "publish_date": "Wed Apr  1 10:35:29 2020", "summary": "", "article_html": "", "meta_description": "Las reglas, que se aplican a cualquier embarcaci\u00f3n que lleve m\u00e1s de 50 personas, se emitieron en un bolet\u00edn de seguridad del 29 de marzo", "meta_lang": "es", "meta_favicon": "https://media.telemundo31.com/2019/09/cropped-TLMD_31_Orlando.png?fit=32%2C32", "meta_data": {"viewport": "width=device-width, initial-scale=1", "generator": "WordPress 5.5.2", "og": {"site_name": "Telemundo Orlando (31)", "type": "article", "description": "Las reglas, que se aplican a cualquier embarcaci\u00f3n que lleve m\u00e1s de 50 personas, se emitieron en un bolet\u00edn de seguridad del 29 de marzo", "title": "Guardia Costera: cruceros con enfermos deben permanecer en el mar", "url": "https://www.telemundo31.com/noticias/eeuu/guardia-costera-cruceros-con-enfermos-deben-permanecer-en-el-mar/1982428/", "image": "https://media.telemundo31.com/2019/09/GettyImages-1208425344.jpg?fit=1200%2C675"}, "google-site-verification": "sYwz_9sB0u6MmEHV22rHixycb5SqTjRbTzmAEpZXqJE", "fb": {"app_id": 516321075179066}, "twitter": {"card": "summary_large_image", "site": "@telemundo31", "creator": "@telemundo31", "description": "Las reglas, que se aplican a cualquier embarcaci\u00f3n que lleve m\u00e1s de 50 personas, se emitieron en un bolet\u00edn de seguridad del 29 de marzo", "title": "Guardia Costera: cruceros con enfermos deben permanecer en el mar", "url": "https://www.telemundo31.com/noticias/eeuu/guardia-costera-cruceros-con-enfermos-deben-permanecer-en-el-mar/1982428/", "image": "https://media.telemundo31.com/2019/09/GettyImages-1208425344.jpg?fit=1200%2C675"}, "article": {"opinion": "false", "content_tier": "free", "publisher": "https://www.facebook.com/Telemundo31/"}, "description": "Las reglas, que se aplican a cualquier embarcaci\u00f3n que lleve m\u00e1s de 50 personas, se emitieron en un bolet\u00edn de seguridad del 29 de marzo", "keywords": "Florida, mar, pa\u00edses, sur, Bahamas, Zaandam, Puerto Rico, Carolina del Sur, Georgia, distrito, sur, puertos, costa, Canal de Panam\u00e1, Panam\u00e1, estadounidenses, regi\u00f3n, sudamericano, Rotterdam, Guardia Costera de los Estados Unidos, Miami Herald, AP, SEC, compa\u00f1\u00eda, huracanes, muertes, viaje, cruceros, buques, coronavirus, embarcaci\u00f3n, orden, tripulaci\u00f3n, cruceros, Port Everglades, cruceros, alta mar, docenas, seguridad, bolet\u00edn, Contralmirante, reglas, bordo, s\u00edntomas, Dos, COVID-19, Coronavirus, Florida", "sailthru.title": "Guardia Costera: cruceros con enfermos deben permanecer en el mar", "sailthru.description": "Las reglas, que se aplican a cualquier embarcaci\u00f3n que lleve m\u00e1s de 50 personas, se emitieron en un bolet\u00edn de seguridad del 29 de marzo", "sailthru.tags": "Florida, mar, pa\u00edses, sur, Bahamas, Zaandam, Puerto Rico, Carolina del Sur, Georgia, distrito, sur, puertos, costa, Canal de Panam\u00e1, Panam\u00e1, estadounidenses, regi\u00f3n, sudamericano, Rotterdam, Guardia Costera de los Estados Unidos, Miami Herald, AP, SEC, compa\u00f1\u00eda, huracanes, muertes, viaje, cruceros, buques, coronavirus, embarcaci\u00f3n, orden, tripulaci\u00f3n, cruceros, Port Everglades, cruceros, alta mar, docenas, seguridad, bolet\u00edn, Contralmirante, reglas, bordo, s\u00edntomas, Dos, COVID-19, Coronavirus, Florida", "sailthru.type": "article", "sailthru.date": "2020-04-01T10:35:29+00:00", "taboola_lead": "video", "msapplication-TileImage": "https://media.telemundo31.com/2019/09/cropped-TLMD_31_Orlando.png?fit=270%2C270"}, "canonical_link": "https://www.telemundo51.com/noticias/local/guardia-costera-cruceros-con-enfermos-deben-permanecer-en-el-mar/2062956/"}